{"attribution":"ZORG Build 0.2 explicit mathematical construction; creator artistic review pending","basis":"home-relative-world-half-height","description":"Original immutable home coordinates.","element_ids":["accent_left","accent_right","base_left","base_right","core_00","core_01","head_00","head_01"],"field_sha256":"f6f5172afbab843f23a0cd39053acf635c6eb417f3b8a5f494e55ebc26117bcc","id":"home","offsets":[[0.0,0.0],[0.0,0.0],[0.0,0.0],[0.0,0.0],[0.0,0.0],[0.0,0.0],[0.0,0.0],[0.0,0.0]],"schema_version":"cz-morph-target-0.1"}
