{"attribution":"ZORG Build 0.2 explicit mathematical construction; creator artistic review pending","basis":"home-relative-world-half-height","description":"Two separated broad lobes, a smaller middle lobe and raised shoulder controls.","element_ids":["accent_left","accent_right","base_left","base_right","core_00","core_01","head_00","head_01"],"field_sha256":"f6f5172afbab843f23a0cd39053acf635c6eb417f3b8a5f494e55ebc26117bcc","id":"cloud","offsets":[[-0.20957,-0.032299999999999995],[0.20957,-0.032299999999999995],[-0.0036700000000000066,0.19417],[0.0036700000000000066,0.19417],[-0.38,0.23079],[0.38,0.09],[0.0,0.04957],[-0.04446,-0.021579999999999988]],"schema_version":"cz-morph-target-0.1"}
