{"attribution":"ZORG Build 0.2 explicit mathematical construction; creator artistic review pending","basis":"home-relative-world-half-height","description":"Separate broad kernels horizontally with a lower base and shallow central crest.","element_ids":["accent_left","accent_right","base_left","base_right","core_00","core_01","head_00","head_01"],"field_sha256":"f6f5172afbab843f23a0cd39053acf635c6eb417f3b8a5f494e55ebc26117bcc","id":"hill","offsets":[[-0.22957000000000002,-0.3523],[0.22957000000000002,-0.3523],[-0.15367,0.09417000000000003],[0.15367,0.09417000000000003],[-0.27,0.05079],[0.27,-0.09],[0.0,-0.14043],[-0.04446,-0.18158]],"schema_version":"cz-morph-target-0.1"}
