{"attribution":"ZORG Build 0.2 explicit mathematical construction; creator artistic review pending","basis":"home-relative-world-half-height","description":"Place controls along a vertical spine; retain bilateral pairing for small kernels.","element_ids":["accent_left","accent_right","base_left","base_right","core_00","core_01","head_00","head_01"],"field_sha256":"f6f5172afbab843f23a0cd39053acf635c6eb417f3b8a5f494e55ebc26117bcc","id":"oval","offsets":[[0.13043,-0.1723],[-0.13043,-0.1723],[0.06633,-0.025829999999999964],[-0.06633,-0.025829999999999964],[0.0,-0.039209999999999995],[0.0,0.1],[0.0,0.12957],[-0.04446,0.06841999999999998]],"schema_version":"cz-morph-target-0.1"}
