{"attribution":"ZORG Build 0.2 explicit mathematical construction; creator artistic review pending","basis":"home-relative-world-half-height","description":"Co-locate all eight radial kernels at the origin: exactly radial field before sampling.","element_ids":["accent_left","accent_right","base_left","base_right","core_00","core_01","head_00","head_01"],"field_sha256":"f6f5172afbab843f23a0cd39053acf635c6eb417f3b8a5f494e55ebc26117bcc","id":"circle","offsets":[[0.17043,-0.2223],[-0.17043,-0.2223],[0.09633,0.27417],[-0.09633,0.27417],[0.0,0.14079],[0.0,0.0],[0.0,-0.17043],[-0.04446,-0.28158]],"schema_version":"cz-morph-target-0.1"}
